{
  "schema_version": "1.0",
  "university_code": "bseu",
  "admission_year": 2026,
  "checked_at": "2026-07-18T15:33:35+03:00",
  "source_policy": {
    "official_only": true,
    "hierarchy": [
      "Official BSEU pages and documents for the 2026 admission campaign",
      "Official Belarusian government or education-authority documents only when BSEU relies on them or they define the applicable rule"
    ],
    "allowed_domains": [
      "bseu.by"
    ],
    "local_scope_source": "docs/data/bseu-program-import-candidates.json",
    "note": "The target set is derived only from the 17 confirmed imported BSEU Program identities; the 20 needs_review Offering candidates are excluded."
  },
  "sources": [
    {
      "source_id": "bseu-2026-admission-order",
      "url": "https://bseu.by/russian/abiturient/pravila2026.pdf",
      "title": "Порядок приема в учреждение образования «Белорусский государственный экономический университет» на 2026 год для получения общего высшего образования",
      "publisher": "Белорусский государственный экономический университет",
      "publication_or_admission_year": 2026,
      "source_type": "official_regulation",
      "checked_at": "2026-07-18T15:33:35+03:00",
      "relevant_reference": "PDF pages 2–9: full-time, part-time full-track and shortened-track tables; page 10: targeted-training internal examination rule",
      "evidence_note": "Defines the 2026 BSEU Program codes, applicable study tracks, profile subjects and whether assessment is ЦЭ/ЦТ or an internal written/oral examination.",
      "content_sha256": "ee330c61eb31ea26ad7be73d037ae600fc326c0ecb08d0cd56688f2a3ac414dc"
    },
    {
      "source_id": "bseu-2026-shortened-exams",
      "url": "https://bseu.by/russian/abiturient/examslist.htm",
      "title": "Предметы и программы вступительных испытаний для абитуриентов, поступающих в сокращенный срок заочной формы обучения",
      "publisher": "Белорусский государственный экономический университет",
      "publication_or_admission_year": 2026,
      "source_type": "html",
      "checked_at": "2026-07-18T15:33:35+03:00",
      "relevant_reference": "Section «Перечень предметов вступительных испытаний ... в сокращенный срок в 2026 году»",
      "evidence_note": "Corroborates the two written internal subjects for each 2026 part-time shortened-track specialty.",
      "content_sha256": "8e71926fcadcd02028e9e223c77021c4c0c40f62df71bcff7d144c29d26ef699"
    },
    {
      "source_id": "bseu-2026-target-specialties",
      "url": "https://bseu.by/russian/abiturient/targ2026/specials.htm",
      "title": "Перечень специальностей, по которым будет осуществляться набор абитуриентов на условиях целевой подготовки в 2026 году",
      "publisher": "Белорусский государственный экономический университет",
      "publication_or_admission_year": 2026,
      "source_type": "html",
      "checked_at": "2026-07-18T15:33:35+03:00",
      "relevant_reference": "The nine-code BSEU target-training list for 2026",
      "evidence_note": "Identifies which exact BSEU specialties use the targeted-training pathway in 2026; six are in the confirmed imported Program set.",
      "content_sha256": "45b8abda5caf7c36f9a29dd84254dfbee3bc9b7df4842a1a977df2de321dc5fa"
    }
  ],
  "requirement_definitions": [
    {
      "definition_id": "full-foreign-history-centralized",
      "label": "Полный срок: язык по выбору, иностранный язык, история по варианту программы испытания",
      "subject_groups": [
        {
          "group_key": "language",
          "position": 1,
          "choose_count": 1,
          "allowed_subjects": [
            { "subject_key": "belarusian_language", "official_label_ru": "Белорусский язык", "official_label_be": null },
            { "subject_key": "russian_language", "official_label_ru": "Русский язык", "official_label_be": null }
          ],
          "assessment_form": "ce_or_ct",
          "note": "Абитуриент выбирает один из двух языков."
        },
        {
          "group_key": "profile_first",
          "position": 2,
          "choose_count": 1,
          "allowed_subjects": [
            { "subject_key": "foreign_language", "official_label_ru": "Иностранный язык", "official_label_be": null }
          ],
          "assessment_form": "ce_or_ct",
          "note": null
        },
        {
          "group_key": "profile_second",
          "position": 3,
          "choose_count": 1,
          "allowed_subjects": [
            { "subject_key": "history_belarus", "official_label_ru": "История Беларуси", "official_label_be": null },
            { "subject_key": "history_belarus_world_context", "official_label_ru": "История Беларуси в контексте всемирной истории", "official_label_be": null }
          ],
          "assessment_form": "ce_or_ct",
          "note": "Официальный порядок приводит варианты через косую черту; это одна позиция с выбором одного применимого варианта."
        }
      ],
      "source_ids": ["bseu-2026-admission-order"]
    },
    {
      "definition_id": "full-math-foreign-centralized",
      "label": "Полный срок: язык по выбору, математика, иностранный язык",
      "subject_groups": [
        {
          "group_key": "language",
          "position": 1,
          "choose_count": 1,
          "allowed_subjects": [
            { "subject_key": "belarusian_language", "official_label_ru": "Белорусский язык", "official_label_be": null },
            { "subject_key": "russian_language", "official_label_ru": "Русский язык", "official_label_be": null }
          ],
          "assessment_form": "ce_or_ct",
          "note": "Абитуриент выбирает один из двух языков."
        },
        {
          "group_key": "profile_first",
          "position": 2,
          "choose_count": 1,
          "allowed_subjects": [
            { "subject_key": "mathematics", "official_label_ru": "Математика", "official_label_be": null }
          ],
          "assessment_form": "ce_or_ct",
          "note": null
        },
        {
          "group_key": "profile_second",
          "position": 3,
          "choose_count": 1,
          "allowed_subjects": [
            { "subject_key": "foreign_language", "official_label_ru": "Иностранный язык", "official_label_be": null }
          ],
          "assessment_form": "ce_or_ct",
          "note": null
        }
      ],
      "source_ids": ["bseu-2026-admission-order"]
    },
    {
      "definition_id": "full-social-history-centralized",
      "label": "Полный срок: язык по выбору, обществоведение, история по варианту программы испытания",
      "subject_groups": [
        {
          "group_key": "language",
          "position": 1,
          "choose_count": 1,
          "allowed_subjects": [
            { "subject_key": "belarusian_language", "official_label_ru": "Белорусский язык", "official_label_be": null },
            { "subject_key": "russian_language", "official_label_ru": "Русский язык", "official_label_be": null }
          ],
          "assessment_form": "ce_or_ct",
          "note": "Абитуриент выбирает один из двух языков."
        },
        {
          "group_key": "profile_first",
          "position": 2,
          "choose_count": 1,
          "allowed_subjects": [
            { "subject_key": "social_studies", "official_label_ru": "Обществоведение", "official_label_be": null }
          ],
          "assessment_form": "ce_or_ct",
          "note": null
        },
        {
          "group_key": "profile_second",
          "position": 3,
          "choose_count": 1,
          "allowed_subjects": [
            { "subject_key": "history_belarus", "official_label_ru": "История Беларуси", "official_label_be": null },
            { "subject_key": "history_belarus_world_context", "official_label_ru": "История Беларуси в контексте всемирной истории", "official_label_be": null }
          ],
          "assessment_form": "ce_or_ct",
          "note": "Официальный порядок приводит варианты через косую черту; это одна позиция с выбором одного применимого варианта."
        }
      ],
      "source_ids": ["bseu-2026-admission-order"]
    },
    {
      "definition_id": "shortened-economics-accounting-written",
      "label": "Сокращенный срок: экономика организации и бухгалтерский учет",
      "subject_groups": [
        {
          "group_key": "profile_first",
          "position": 1,
          "choose_count": 1,
          "allowed_subjects": [
            { "subject_key": "organization_economics", "official_label_ru": "Экономика организации", "official_label_be": null }
          ],
          "assessment_form": "internal_written",
          "note": null
        },
        {
          "group_key": "profile_second",
          "position": 2,
          "choose_count": 1,
          "allowed_subjects": [
            { "subject_key": "accounting", "official_label_ru": "Бухгалтерский учет", "official_label_be": null }
          ],
          "assessment_form": "internal_written",
          "note": null
        }
      ],
      "source_ids": ["bseu-2026-admission-order", "bseu-2026-shortened-exams"]
    },
    {
      "definition_id": "shortened-economics-it-written",
      "label": "Сокращенный срок: экономика организации и информационные технологии",
      "subject_groups": [
        {
          "group_key": "profile_first",
          "position": 1,
          "choose_count": 1,
          "allowed_subjects": [
            { "subject_key": "organization_economics", "official_label_ru": "Экономика организации", "official_label_be": null }
          ],
          "assessment_form": "internal_written",
          "note": null
        },
        {
          "group_key": "profile_second",
          "position": 2,
          "choose_count": 1,
          "allowed_subjects": [
            { "subject_key": "information_technology", "official_label_ru": "Информационные технологии", "official_label_be": null }
          ],
          "assessment_form": "internal_written",
          "note": null
        }
      ],